{"$schema":"https://json-schema.org/draft/2020-12/schema","type":"object","properties":{"version":{"type":"string","const":"v1"},"license":{"type":"string","const":"CC BY 4.0"},"updated":{"type":"string","pattern":"^\\d{4}-\\d{2}-\\d{2}$"},"rule":{"type":"string","description":"What a server must meet to be listed"},"servers":{"type":"array","items":{"type":"object","properties":{"id":{"type":"string","description":"{list}/{project}, as in the project document"},"name":{"type":"string"},"repo":{"type":"string","description":"owner/name on GitHub"},"registry_name":{"type":"string","description":"The server's name in the official MCP Registry (safety check 2)"},"packages":{"type":"array","items":{"type":"object","properties":{"registry":{"type":"string","enum":["npm","pypi"]},"name":{"type":"string"},"version":{"type":"string","description":"The latest version, which checks 1, 3, 4 and 5 read"},"integrity":{"description":"npm dist.integrity, or sha256 of the PyPI file read (a wheel when there is one)","type":["string","null"]}},"required":["registry","name","version","integrity"],"additionalProperties":false},"description":"The package versions the checks read"},"checked":{"type":"string","pattern":"^\\d{4}-\\d{2}-\\d{2}$","description":"Safety run date"},"commit":{"type":"string","description":"Commit of the default branch whose files were read"},"content_hash":{"description":"sha256 over \"<path>\\0<sha256 of file>\\n\" for the files of `git archive <commit>`, paths sorted (symlinks and .git, node_modules, .venv, venv, __pycache__ folders left out); null for results read before 2026-10-14","type":["string","null"]},"passed":{"type":"integer","minimum":0,"maximum":9007199254740991},"applicable":{"type":"integer","minimum":0,"maximum":9007199254740991},"url":{"type":"string","format":"uri","description":"The project document, with every check and its evidence"},"source_url":{"type":"string","format":"uri","description":"Canonical page to cite and link"},"checked_at":{"anyOf":[{"type":"string","pattern":"^\\d{4}-\\d{2}-\\d{2}$"},{"type":"null"}],"description":"Date of the GitHub check behind the facts; null when the latest check missed the repo"}},"required":["id","name","repo","registry_name","packages","checked","commit","content_hash","passed","applicable","url","source_url","checked_at"],"additionalProperties":false}}},"required":["version","license","updated","rule","servers"],"additionalProperties":false}