{"version":"v1","license":"CC BY 4.0","updated":"2026-10-15","rule":"MCP servers whose latest Archestack safety run passed every applicable check and that are listed in the official MCP Registry under the owner's name, pinned to the package versions and commit that were read","servers":[{"id":"best-of-vibe-coding/repomix","name":"repomix","repo":"yamadashy/repomix","registry_name":"io.github.yamadashy/repomix","packages":[{"registry":"npm","name":"repomix","version":"1.18.1","integrity":"sha512-XtV1qD6akJSigQ3fBRex5v+rWcGa4i9cm2FL/M/PEtzO3u1uDiso3CtNbhlZiMIqJstAdy8mj2m1ynOzNnNB3g=="}],"checked":"2026-10-14","commit":"55c6de6aebde4c38877fbcaf005c4cc396bf6e2d","content_hash":"sha256:46f8508fd3341f9c72b47533f3e757df6fcec764e40b57ca640fc4f76b8c456f","passed":16,"applicable":16,"url":"https://archestack.com/api/v1/projects/best-of-vibe-coding/repomix.json","source_url":"https://archestack.com/best-of-vibe-coding/projects/repomix/","checked_at":"2026-10-15"},{"id":"best-of-vibe-coding/chrome-devtools-mcp","name":"chrome-devtools-mcp","repo":"chromedevtools/chrome-devtools-mcp","registry_name":"io.github.ChromeDevTools/chrome-devtools-mcp","packages":[{"registry":"npm","name":"chrome-devtools-mcp","version":"1.10.1","integrity":"sha512-Klw6HWDqHC/XS1JwZldd2r49aUhbUJN9m9Mvcx4SEueIPXtzuQX+QelxAViobv8YUkDZ7HWDrmViR6LeYK0wAw=="}],"checked":"2026-10-14","commit":"9de05ae6e59c5eec74abff7992711f4d93875f9c","content_hash":"sha256:883f7b621f5416265d9c9e3081c8d2d72aadd55f6d528efb6aeaf905bd05d953","passed":16,"applicable":16,"url":"https://archestack.com/api/v1/projects/best-of-vibe-coding/chrome-devtools-mcp.json","source_url":"https://archestack.com/best-of-vibe-coding/projects/chrome-devtools-mcp/","checked_at":"2026-10-15"}]}